{
  "$schema": "https://json-schema.org/draft/2020-12/schema",
  "$id": "https://screens.gitci.com/schemas/scene-template.gitci.schema.json",
  "title": "GitCI Screens Scene Template",
  "type": "object",
  "required": ["schemaVersion", "id", "name", "entry", "export"],
  "additionalProperties": true,
  "properties": {
    "schemaVersion": { "const": 1 },
    "id": { "type": "string", "minLength": 1 },
    "name": { "type": "string", "minLength": 1 },
    "pack": { "type": "string" },
    "entry": { "type": "string" },
    "export": { "type": "string" },
    "tags": { "type": "array", "items": { "type": "string" } },
    "minAspectRatio": { "type": "number", "minimum": 0 },
    "supportedTargets": { "type": "array", "items": { "type": "string" } },
    "propsSchema": { "type": "object" },
    "previewProps": { "type": "object" }
  }
}
